{
  "schema_version": "1.0",
  "source_file": "big5.csv",
  "source_sha256": "ec68ccf0061b200e8fa4247d36c6ed91e3a79fca9f40a4f579b626a34c3506fc",
  "file_type": "csv",
  "root_element_id": "document-root",
  "element_count": 2,
  "content_element_count": 1,
  "elements": [
    {
      "parent_id": null,
      "children": [
        "csv-table-0001"
      ],
      "child_ids": [
        "csv-table-0001"
      ],
      "content": "",
      "content_format": "markdown",
      "heading_path": [],
      "engine": "csv_native",
      "confidence": null,
      "source_locator": {
        "page": null,
        "slide": null,
        "sheet": null,
        "cell_range": null,
        "shape_id": null,
        "shape_name": null,
        "bbox": null,
        "table_index": null,
        "relationship_id": null,
        "part": null,
        "source_file": "big5.csv",
        "format": "csv",
        "sheet_name": null,
        "anchor_cell": null,
        "slide_number": null,
        "shape_ids": null,
        "page_start": null,
        "page_end": null,
        "bboxes": null,
        "section_index": null,
        "element_start": null,
        "element_end": null,
        "row_start": null,
        "row_end": null,
        "json_path": null,
        "mime_part": null,
        "section": null,
        "filename": null,
        "element_index": null,
        "element_id": null
      },
      "locator_precision": "unknown",
      "properties": {},
      "warnings": [],
      "id": "document-root",
      "type": "document",
      "ordinal": 0
    },
    {
      "parent_id": "document-root",
      "children": [],
      "child_ids": [],
      "content": "<!-- source_encoding: big5 -->\n| 名稱 | 數量 |\n| --- | --- |\n| 鋼管 | 10 |\n",
      "content_format": "markdown",
      "heading_path": [],
      "engine": "csv_native",
      "confidence": null,
      "source_locator": {
        "page": null,
        "slide": null,
        "sheet": null,
        "cell_range": null,
        "shape_id": null,
        "shape_name": null,
        "bbox": null,
        "table_index": null,
        "relationship_id": null,
        "part": null,
        "source_file": null,
        "format": "csv",
        "sheet_name": null,
        "anchor_cell": null,
        "slide_number": null,
        "shape_ids": null,
        "page_start": null,
        "page_end": null,
        "bboxes": null,
        "section_index": null,
        "element_start": null,
        "element_end": null,
        "row_start": 1,
        "row_end": 2,
        "json_path": null,
        "mime_part": null,
        "section": null,
        "filename": null,
        "element_index": null,
        "element_id": null
      },
      "locator_precision": "exact",
      "properties": {},
      "warnings": [],
      "id": "csv-table-0001",
      "type": "table",
      "table_id": "table-0001",
      "ordinal": 1
    }
  ]
}