{
  "schema_version": "1.0",
  "source_file": "docx_basic.docx",
  "source_sha256": "897e11ee9286688ea239028bd2ccad3d26753bcd8b72bcc7369ea40bf96c0fc3",
  "file_type": "docx",
  "root_element_id": "document-root",
  "element_count": 2,
  "content_element_count": 1,
  "elements": [
    {
      "parent_id": null,
      "children": [
        "p0001"
      ],
      "child_ids": [
        "p0001"
      ],
      "content": "",
      "content_format": "markdown",
      "heading_path": [],
      "engine": "python-docx_custom",
      "confidence": null,
      "source_locator": {
        "page": null,
        "slide": null,
        "sheet": null,
        "cell_range": null,
        "shape_id": null,
        "shape_name": null,
        "bbox": null,
        "table_index": null,
        "relationship_id": null,
        "part": null,
        "source_file": "docx_basic.docx",
        "format": "docx",
        "sheet_name": null,
        "anchor_cell": null,
        "slide_number": null,
        "shape_ids": null,
        "page_start": null,
        "page_end": null,
        "bboxes": null,
        "section_index": 0,
        "element_start": 0,
        "element_end": 0,
        "row_start": null,
        "row_end": null,
        "json_path": null,
        "mime_part": null,
        "section": null,
        "filename": null,
        "element_index": null,
        "element_id": null
      },
      "locator_precision": "range",
      "properties": {},
      "warnings": [],
      "id": "document-root",
      "type": "document",
      "ordinal": 0
    },
    {
      "parent_id": "document-root",
      "children": [],
      "child_ids": [],
      "content": "**bold*** italic*",
      "content_format": "markdown",
      "heading_path": [],
      "engine": "python-docx_custom",
      "confidence": null,
      "source_locator": {
        "page": null,
        "slide": null,
        "sheet": null,
        "cell_range": null,
        "shape_id": null,
        "shape_name": null,
        "bbox": null,
        "table_index": null,
        "relationship_id": null,
        "part": null,
        "source_file": null,
        "format": "docx",
        "sheet_name": null,
        "anchor_cell": null,
        "slide_number": null,
        "shape_ids": null,
        "page_start": null,
        "page_end": null,
        "bboxes": null,
        "section_index": 0,
        "element_start": 1,
        "element_end": 1,
        "row_start": null,
        "row_end": null,
        "json_path": null,
        "mime_part": null,
        "section": null,
        "filename": null,
        "element_index": null,
        "element_id": null
      },
      "locator_precision": "range",
      "properties": {},
      "warnings": [],
      "id": "p0001",
      "type": "paragraph",
      "level": null,
      "ordinal": 1
    }
  ]
}