{
  "schema_version": "1.0",
  "source_file": "xlsx_merged.xlsx",
  "source_sha256": "d7d3a82b4cf5e16fcc3d9e8f39603ab444523868eb13ffb00e31bc35a919643b",
  "file_type": "xlsx",
  "root_element_id": "document-root",
  "element_count": 3,
  "content_element_count": 2,
  "elements": [
    {
      "parent_id": null,
      "children": [
        "sheet-001"
      ],
      "child_ids": [
        "sheet-001"
      ],
      "content": "",
      "content_format": "markdown",
      "heading_path": [],
      "engine": "openpyxl_custom",
      "confidence": null,
      "source_locator": {
        "page": null,
        "slide": null,
        "sheet": null,
        "cell_range": null,
        "shape_id": null,
        "shape_name": null,
        "bbox": null,
        "table_index": null,
        "relationship_id": null,
        "part": null,
        "source_file": "xlsx_merged.xlsx",
        "format": "xlsx",
        "sheet_name": null,
        "anchor_cell": null,
        "slide_number": null,
        "shape_ids": null,
        "page_start": null,
        "page_end": null,
        "bboxes": null,
        "section_index": null,
        "element_start": null,
        "element_end": null,
        "row_start": null,
        "row_end": null,
        "json_path": null,
        "mime_part": null,
        "section": null,
        "filename": null,
        "element_index": null,
        "element_id": null
      },
      "locator_precision": "unknown",
      "properties": {},
      "warnings": [],
      "id": "document-root",
      "type": "document",
      "ordinal": 0
    },
    {
      "parent_id": "document-root",
      "children": [
        "element-table-s001-b001"
      ],
      "child_ids": [
        "element-table-s001-b001"
      ],
      "content": "## Sheet: Sheet",
      "content_format": "markdown",
      "heading_path": [],
      "engine": "html_table_with_span",
      "confidence": null,
      "source_locator": {
        "page": null,
        "slide": null,
        "sheet": "Sheet",
        "cell_range": null,
        "shape_id": null,
        "shape_name": null,
        "bbox": null,
        "table_index": null,
        "relationship_id": null,
        "part": null,
        "source_file": null,
        "format": "xlsx",
        "sheet_name": "Sheet",
        "anchor_cell": null,
        "slide_number": null,
        "shape_ids": null,
        "page_start": null,
        "page_end": null,
        "bboxes": null,
        "section_index": null,
        "element_start": null,
        "element_end": null,
        "row_start": null,
        "row_end": null,
        "json_path": null,
        "mime_part": null,
        "section": null,
        "filename": null,
        "element_index": null,
        "element_id": null
      },
      "locator_precision": "unknown",
      "properties": {},
      "warnings": [],
      "id": "sheet-001",
      "type": "sheet",
      "sheet_name": "Sheet",
      "merged_ranges": 1,
      "ordinal": 1
    },
    {
      "parent_id": "sheet-001",
      "children": [],
      "child_ids": [],
      "content": "<table>\n<tr>\n<td colspan=\"2\">Header</td>\n</tr>\n<tr>\n<td>A</td>\n<td>1</td>\n</tr>\n</table>",
      "content_format": "markdown",
      "heading_path": [],
      "engine": "html_table_with_span",
      "confidence": null,
      "source_locator": {
        "page": null,
        "slide": null,
        "sheet": "Sheet",
        "cell_range": "A1:B2",
        "shape_id": null,
        "shape_name": null,
        "bbox": null,
        "table_index": null,
        "relationship_id": null,
        "part": null,
        "source_file": null,
        "format": "xlsx",
        "sheet_name": "Sheet",
        "anchor_cell": null,
        "slide_number": null,
        "shape_ids": null,
        "page_start": null,
        "page_end": null,
        "bboxes": null,
        "section_index": null,
        "element_start": null,
        "element_end": null,
        "row_start": null,
        "row_end": null,
        "json_path": null,
        "mime_part": null,
        "section": null,
        "filename": null,
        "element_index": null,
        "element_id": null
      },
      "locator_precision": "exact",
      "properties": {
        "block_index": 1,
        "merged_ranges": 1
      },
      "warnings": [],
      "id": "element-table-s001-b001",
      "type": "table",
      "table_id": "table-s001-b001",
      "ordinal": 2
    }
  ]
}